<?xml version="1.0"?>
<!DOCTYPE resource-action-mapping PUBLIC "-//Liferay//DTD Resource Action Mapping 7.0.0//EN" "http://www.liferay.com/dtd/liferay-resource-action-mapping_7_0_0.dtd">

<resource-action-mapping>
	<model-resource>
		<model-name>com.liferay.dynamic.data.lists</model-name>
		<portlet-ref>
			<portlet-name>com_liferay_dynamic_data_lists_form_web_portlet_DDLFormAdminPortlet</portlet-name>
			<portlet-name>com_liferay_dynamic_data_lists_web_portlet_DDLDisplayPortlet</portlet-name>
			<portlet-name>com_liferay_dynamic_data_lists_web_portlet_DDLPortlet</portlet-name>
		</portlet-ref>
		<root>true</root>
		<weight>1</weight>
		<permissions>
			<supports>
				<action-key>ADD_RECORD_SET</action-key>
				<action-key>ADD_STRUCTURE</action-key>
				<action-key>ADD_TEMPLATE</action-key>
			</supports>
			<site-member-defaults />
			<guest-defaults />
			<guest-unsupported>
				<action-key>ADD_RECORD_SET</action-key>
				<action-key>ADD_STRUCTURE</action-key>
				<action-key>ADD_TEMPLATE</action-key>
			</guest-unsupported>
		</permissions>
	</model-resource>
	<model-resource>
		<model-name>com.liferay.dynamic.data.lists.model.DDLRecordSet</model-name>
		<portlet-ref>
			<portlet-name>com_liferay_dynamic_data_lists_web_portlet_DDLDisplayPortlet</portlet-name>
			<portlet-name>com_liferay_dynamic_data_lists_web_portlet_DDLPortlet</portlet-name>
		</portlet-ref>
		<weight>2</weight>
		<permissions>
			<supports>
				<action-key>ADD_RECORD</action-key>
				<action-key>DELETE</action-key>
				<action-key>PERMISSIONS</action-key>
				<action-key>UPDATE</action-key>
				<action-key>VIEW</action-key>
			</supports>
			<site-member-defaults>
				<action-key>VIEW</action-key>
			</site-member-defaults>
			<guest-defaults>
				<action-key>VIEW</action-key>
			</guest-defaults>
			<guest-unsupported>
				<action-key>UPDATE</action-key>
			</guest-unsupported>
		</permissions>
	</model-resource>
	<model-resource>
		<model-name>com.liferay.dynamic.data.lists.model.DDLRecordSet</model-name>
		<portlet-ref>
			<portlet-name>com_liferay_dynamic_data_lists_form_web_portlet_DDLFormAdminPortlet</portlet-name>
		</portlet-ref>
		<weight>2</weight>
		<permissions>
			<supports>
				<action-key>ADD_RECORD</action-key>
				<action-key>DELETE</action-key>
				<action-key>PERMISSIONS</action-key>
				<action-key>UPDATE</action-key>
				<action-key>VIEW</action-key>
			</supports>
			<site-member-defaults />
			<guest-defaults />
			<guest-unsupported>
				<action-key>UPDATE</action-key>
			</guest-unsupported>
		</permissions>
	</model-resource>
	<model-resource>
		<composite-model-name>
			<model-name>com.liferay.dynamic.data.lists.model.DDLRecordSet</model-name>
			<model-name>com.liferay.dynamic.data.mapping.model.DDMStructure</model-name>
		</composite-model-name>
		<portlet-ref>
			<portlet-name>com_liferay_dynamic_data_lists_web_portlet_DDLDisplayPortlet</portlet-name>
			<portlet-name>com_liferay_dynamic_data_lists_web_portlet_DDLPortlet</portlet-name>
		</portlet-ref>
		<weight>3</weight>
		<permissions>
			<supports>
				<action-key>DELETE</action-key>
				<action-key>PERMISSIONS</action-key>
				<action-key>UPDATE</action-key>
				<action-key>VIEW</action-key>
			</supports>
			<site-member-defaults>
				<action-key>VIEW</action-key>
			</site-member-defaults>
			<guest-defaults>
				<action-key>VIEW</action-key>
			</guest-defaults>
			<guest-unsupported>
				<action-key>UPDATE</action-key>
			</guest-unsupported>
		</permissions>
	</model-resource>
	<model-resource>
		<composite-model-name>
			<model-name>com.liferay.dynamic.data.lists.model.DDLRecordSet</model-name>
			<model-name>com.liferay.dynamic.data.mapping.model.DDMStructure</model-name>
		</composite-model-name>
		<portlet-ref>
			<portlet-name>com_liferay_dynamic_data_lists_form_web_portlet_DDLFormAdminPortlet</portlet-name>
		</portlet-ref>
		<weight>3</weight>
		<permissions>
			<supports>
				<action-key>DELETE</action-key>
				<action-key>PERMISSIONS</action-key>
				<action-key>UPDATE</action-key>
				<action-key>VIEW</action-key>
			</supports>
			<site-member-defaults />
			<guest-defaults />
			<guest-unsupported>
				<action-key>UPDATE</action-key>
			</guest-unsupported>
		</permissions>
	</model-resource>
	<model-resource>
		<composite-model-name>
			<model-name>com.liferay.dynamic.data.lists.model.DDLRecordSet</model-name>
			<model-name>com.liferay.dynamic.data.mapping.model.DDMTemplate</model-name>
		</composite-model-name>
		<portlet-ref>
			<portlet-name>com_liferay_dynamic_data_lists_web_portlet_DDLDisplayPortlet</portlet-name>
			<portlet-name>com_liferay_dynamic_data_lists_web_portlet_DDLPortlet</portlet-name>
		</portlet-ref>
		<weight>4</weight>
		<permissions>
			<supports>
				<action-key>DELETE</action-key>
				<action-key>PERMISSIONS</action-key>
				<action-key>UPDATE</action-key>
				<action-key>VIEW</action-key>
			</supports>
			<site-member-defaults>
				<action-key>VIEW</action-key>
			</site-member-defaults>
			<guest-defaults>
				<action-key>VIEW</action-key>
			</guest-defaults>
			<guest-unsupported>
				<action-key>UPDATE</action-key>
			</guest-unsupported>
		</permissions>
	</model-resource>
</resource-action-mapping>