<?xml version="1.0"?>
<!DOCTYPE resource-action-mapping PUBLIC "-//Liferay//DTD Resource Action Mapping 7.0.0//EN" "http://www.liferay.com/dtd/liferay-resource-action-mapping_7_0_0.dtd">

<resource-action-mapping>
	<portlet-resource>
		<portlet-name>com_liferay_test_portlet_TestPortlet</portlet-name>
		<permissions>
			<supports>
				<action-key>ADD_TO_PAGE</action-key>
				<action-key>CONFIGURATION</action-key>
				<action-key>PORTLET_TEST_ACTION_1</action-key>
				<action-key>PORTLET_TEST_ACTION_2</action-key>
				<action-key>VIEW</action-key>
			</supports>
			<site-member-defaults>
				<action-key>PORTLET_TEST_ACTION_1</action-key>
				<action-key>VIEW</action-key>
			</site-member-defaults>
			<guest-defaults>
				<action-key>PORTLET_TEST_ACTION_1</action-key>
				<action-key>VIEW</action-key>
			</guest-defaults>
			<guest-unsupported>
				<action-key>CONFIGURATION</action-key>
				<action-key>PORTLET_TEST_ACTION_2</action-key>
			</guest-unsupported>
		</permissions>
	</portlet-resource>

	<portlet-resource>
		<portlet-name>com_liferay_test_portlet_TestPortlet2</portlet-name>
		<permissions>
			<supports>
				<action-key>ADD_TO_PAGE</action-key>
				<action-key>CONFIGURATION</action-key>
				<action-key>PORTLET_TEST_ACTION_1</action-key>
				<action-key>PORTLET_TEST_ACTION_2</action-key>
				<action-key>VIEW</action-key>
			</supports>
			<site-member-defaults>
				<action-key>PORTLET_TEST_ACTION_1</action-key>
				<action-key>VIEW</action-key>
			</site-member-defaults>
			<guest-defaults>
				<action-key>PORTLET_TEST_ACTION_1</action-key>
				<action-key>VIEW</action-key>
			</guest-defaults>
			<guest-unsupported>
				<action-key>CONFIGURATION</action-key>
				<action-key>PORTLET_TEST_ACTION_2</action-key>
			</guest-unsupported>
		</permissions>
	</portlet-resource>

	<model-resource>
		<model-name>com.liferay.test.portlet.TestModel</model-name>
		<portlet-ref>
			<portlet-name>com_liferay_test_portlet_TestPortlet</portlet-name>
		</portlet-ref>
		<root>true</root>
		<weight>1</weight>
		<permissions>
			<supports>
				<action-key>MODEL_TEST_ACTION_1</action-key>
				<action-key>MODEL_TEST_ACTION_2</action-key>
				<action-key>VIEW</action-key>
			</supports>
			<site-member-defaults>
				<action-key>MODEL_TEST_ACTION_1</action-key>
				<action-key>VIEW</action-key>
			</site-member-defaults>
			<guest-defaults>
				<action-key>MODEL_TEST_ACTION_1</action-key>
				<action-key>VIEW</action-key>
			</guest-defaults>
			<guest-unsupported>
				<action-key>MODEL_TEST_ACTION_2</action-key>
			</guest-unsupported>
		</permissions>
	</model-resource>

	<model-resource>
		<model-name>com.liferay.test.portlet.TestModel2</model-name>
		<portlet-ref>
			<portlet-name>com_liferay_test_portlet_TestPortlet</portlet-name>
		</portlet-ref>
		<root>true</root>
		<weight>1</weight>
		<permissions>
			<supports>
				<action-key>MODEL_TEST_ACTION_1</action-key>
				<action-key>MODEL_TEST_ACTION_2</action-key>
				<action-key>VIEW</action-key>
			</supports>
			<site-member-defaults>
				<action-key>MODEL_TEST_ACTION_1</action-key>
				<action-key>VIEW</action-key>
			</site-member-defaults>
			<guest-defaults>
				<action-key>MODEL_TEST_ACTION_1</action-key>
				<action-key>VIEW</action-key>
			</guest-defaults>
			<guest-unsupported>
				<action-key>MODEL_TEST_ACTION_2</action-key>
			</guest-unsupported>
		</permissions>
	</model-resource>
</resource-action-mapping>